begin time,end time,turn,Overlap,Interruption,Successful interruption,turn.holder,speaker,Chinese,Pinyin,English,addressee,arguable.move,issue at stake,substance,whats offered,strategy.detail,strategy,strategy.meaning,option,option.details,target.detail,valence,attitude,explicitness,invocation.signal,trigger,attitude.realisation,graduation.detail,graduation.realisation,engagement.detail,engage.realisation,particle
00:34.9,00:39.1,0,,,,Wife_W01_WW,Wife_W01_WW,现在就是说离开他的视线(1.145）他就是电话一直打,Xiànzài jiùshì shuō líkāi tā de shìxiàn (1.145) Tā jiùshì diànhuà yīzhí dǎ ,Now that is to say whenever I am not within his sight (1.145) he will keep on calling me,camera,,,,,,,,,,antagonist,-ve,judgement,invoke,up-scaling,,一直,,,contract:proclaim,就是说,
00:25.1,00:25.9,0,,,,Husband_W01_AH,Husband_W01_AH,信息拉黑了,xìnxī lā hēile ,She blacklists my SMS messages,camera,,,,,,,,,,antagonist,-ve,judgement,inscribe,,,拉黑,,,monoglossic,,
00:25.9,00:26.7,0,,,,,Husband_W01_AH,电话拉黑了,diànhuà lā hēile ,She blacklists my phone call,camera,,,,,,,,,,antagonist,-ve,judgement,inscribe,,,拉黑,,,monoglossic,,
00:26.7,00:28.2,0,,,,,Husband_W01_AH,她接触也不让你接触,tā jiēchù yě bù ràng nǐ jiēchù ,She does not allow me to touch her,camera,,,,,,,,,,antagonist,-ve,judgement,invoke,counter-expectancy,,不让接触,,,contract:disclaim:counter,也,
00:39.1,00:40.1,0,,,,Wife_W01_WW,Wife_W01_WW,打几十个电话,dǎ jǐ shí gè diànhuà ,He calls me dozens of times,camera,,,,,,,,,,antagonist,-ve,judgement,invoke,up-scaling,,几十个,,,monoglossic,,
00:40.1,00:40.9,0,,,,,Wife_W01_WW,太累了,tài lèile ,(I feel) Too tired,camera,,,,,,,,,,antagonist,-ve,judgement,invoke,attitudinal token,antagonist,累,up:isolated,太……了,monoglossic,,
01:56.2,01:58.5,1,,,,Hostess_W01,Hostess_W01,有问题来调解..来调解没问题,yǒu wèntí lái tiáojiě.. Lái tiáojiě méi wèntí ,If there is a problem come to mediate.. If you come to mediate there will be no problem,,,,,,,,,,,,,,,,,,,,,,
01:58.5,02:00.0,1,,,,,Hostess_W01,大家好..我是张艳,Dàjiā hǎo.. Wǒ shì zhāng yàn ,Hello everyone.. I am Zhang Yan,,,,,,,,,,,,,,,,,,,,,,
02:00.0,02:02.4,1,,,,,Hostess_W01,欢迎本场调解员柏燕谊柏老师,huānyíng běn chǎng tiáojiě yuán bǎi yàn yì bǎi lǎoshī ,Welcome Bai Yanyi teacher Bai today's master mediator,,,,,,,,,,,,,,,,,,,,,,
02:02.4,02:03.3,1,,,,,Hostess_W01,欢迎您,huānyíng nín ,Welcome,,,,,,,,,,,,,,,,,,,,,,
02:03.3,02:05.5,1,,,,,Hostess_W01,欢迎场上的观察员们,huānyíng chǎng shàng de guāncháyuánmen,Welcome all the observers,,,,,,,,,,,,,,,,,,,,,,
02:05.5,02:06.6,1,,,,,Hostess_W01,欢迎大家,huānyíng dàjiā ,welcome everybody,,,,,,,,,,,,,,,,,,,,,,
02:06.6,02:08.7,1,,,,,Hostess_W01,欢迎场上的一对当事人,huānyíng chǎng shàng de yī duì dāngshìrén ,Welcome two participants,,,,,,,,,,,,,,,,,,,,,,
02:08.7,02:09.8,1,,,,,Hostess_W01,是一对夫妻,shì yī duì fūqī ,They are a couple,,,,,,,,,,,,,,,,,,,,,,
02:09.8,02:12.4,1,,,,,Hostess_W01,是吴女士和胡先生,shì wú nǚshì hé hú xiānshēng ,They are Ms. Wu and Mr. Hu,,,,,,,,,,,,,,,,,,,,,,
02:12.4,02:15.7,1,,,,,Hostess_W01,两位今天来到《金牌调解》要解决什么问题,liǎng wèi jīntiān lái dào “jīnpái tiáojiě” yào jiějué shénme wèntí,What problems do you want to resolve by coming to the Gold Medal Mediation ,,,,,,,,,,,,,,,,,,,,,,
02:15.7,02:16.9,2,,,,Wife_W01_WW,Wife_W01_WW,我是要求要离婚,Wǒ shì yāoqiú yào líhūn ,I am asking for a divorce,hostess,IVoE,,,,,,,,,relationship,-ve,appreciation,inscribe,,,离婚,,,contract:proclaim,要求,
02:16.9,02:19.1,2,,,,,Wife_W01_WW,这日子没办法过了,zhè rìzi méi bànfǎguòle ,This life I can’t continue any more,hostess,IVoE,,,,,,,,,relationship,-ve,appreciation,inscribe,,,没法过,up:infused,没法过,monoglossic,,
02:19.1,02:21.2,2,,,,,Wife_W01_WW,没有信任度,méiyǒu xìnrèn dù ,There is no trust,hostess,ExAss,,,,,,,,,relationship,-ve,appreciation,inscribe,,,没有信任度,,,monoglossic,,
02:21.2,02:24.5,2,,,,,Wife_W01_WW,他没有没有一个男人该有的担当,tā méiyǒu méiyǒu yīgè nánrén gāi yǒu de dāndāng,He doesn't doesn't have the responsibility that a man should have,hostess,ExAss,,,,,,,,,antagonist,-ve,judgement,inscribe,,,没有担当,,,contract:disclaim:counter,该有,
02:25.7,02:29.2,3,,,,Husband_W01_AH,Husband_W01_AH,她说的没信任这是没有根据的,Tā shuō de méi xìnrèn Zhè shì méiyǒu gēnjù de,What she said that there is no trust This is groundless,hostess,,没有信任,ExAss,没有根据,reverse or question the assessment,challenge,ExAss,Yes,IVoE; ExAss,antagonist,-ve,judgement,inscribe,,,没有依据,,,contract:proclaim,是的,
02:29.2,02:35.9,3,,,,,Husband_W01_AH,这么多年了(1.087)你这个时候要离婚(1.191)那你的目的是什么呢,Zhème duōniánle (1.087) Nǐ zhège shíhòu yào líhūn (1.191) Nà nǐ de mùdì shì shénme ne,After so many years (1.087) you are asking for a divorce at this time (1.191) then what is your purpose,antagonist,,要离婚,IVoE,目的是什么,replace with an alternative interpretation,replace,IVoE,Yes,IVoE; ExAss,antagonist,-ve,judgement,invoke,rhetorical question,,什么,up:isolated,这么多年,expand:entertain,是什么,
02:35.9,02:38.2,4,O,,,Hostess_W01,Hostess_W01,你觉得[她为什么要离婚],Nǐ juédé [tā wèishéme yào líhūn] ,In your view [why she wants a divorce],husband,,,,,,,,,,,,,,,,,,,expand:entertain,,
02:36.6,02:38.4,5,O,I,,Husband_W01_AH,Husband_W01_AH,[不是我不相信她],[bùshì wǒ bù xiāngxìn tā] ,[It’s not that I don’t believe her],hostess,,,,,,,,,,self,+ve,judgement,invoke,denial,,不是,,,monoglossic,,
02:39.3,02:41.1,5,,,,,Husband_W01_AH,就是我不知道她有什么目的,jiùshì wǒ bù zhīdào tā yǒu shé me mùdì ,It's that I don't know what her purpose is,hostess,,,,,,,,,,antagonist,-ve,judgement,inscribe,,,有目的,,,expand:entertain,不知道,
02:41.1,02:45.8,5,,,,,Husband_W01_AH,但是哈这么多年了我们本来以前是很平常的,dànshì hā zhème duōniánle wǒmen běnlái yǐqián shì hěn píngcháng de ,But ha for so many years we used to be very normal,hostess,,,,,,,,,,couple,+ve,judgement,inscribe,,,正常,up:isolated,很,contract:disclaim:counter,但是,
02:45.8,02:47.7,5,,,,,Husband_W01_AH,都比较刻苦,dōu bǐjiào kèkǔ,we both are somewhat hardworking,hostess,,,,,,,,,,couple,+ve,judgement,inscribe,,,刻苦,down:isolated,比较,contract:proclaim,都,
02:47.7,02:49.6,5,,,,,Husband_W01_AH,也吃得苦,yě chī dé kǔ ,And we can endure hardship,hostess,,,,,,,,,,couple,+ve,judgement,inscribe,,,吃苦,,,monoglossic,,
02:49.6,02:52.9,5,,,,,Husband_W01_AH,在家里两个人基本上是没什么分开,zài jiālǐ liǎng gèrén jīběn shàng shì méi shénme fēnkāi ,At home the two of us have basically never separated,hostess,,,,,,,,,,couple,+ve,judgement,invoke,denial,,没分开,down:isolated,基本上,expand:entertain,基本上,
02:52.9,02:56.1,5,,,,,Husband_W01_AH,我们磕磕碰碰啊都二十几年了,wǒmen kē ke pèng pèng a dōu èrshí jǐ niánle ,We have had arguments for more than 20 years,hostess,,,,,,,,,,couple,-ve,judgement,invoke,up-scaling,,磕磕碰碰,up:isolated,二十几年,monoglossic,,
02:56.1,03:00.6,5,,,,,Husband_W01_AH,反正是就这两三年(1.609)她的变化就太大了,fǎnzhèng shì jiù zhè liǎng sān nián (1.609) Tā de biànhuà jiù tài dàle,Anyway in the past two or three years (1.609) she has changed so much ,hostess,,,,,,,,,,antagonist,-ve,judgement,invoke,contrast,,变化,up:isolated,太……了,contract:proclaim,反正,
03:02.9,03:15.7,5,,,,voiceover,,voiceover,,,,,,,,,,,,,,,,,,,,,,,,
03:15.7,03:18.4,6,,,,Husband_W01_AH,Husband_W01_AH,信息电话全部拉黑了,Xìnxī Diànhuà Quánbù lā hēile,She blacklists all my SMS messages and phone calls,hostess,,,,,,,,,,antagonist,-ve,judgement,inscribe,,,拉黑,up:isolated,全部,monoglossic,,
03:18.4,03:24.5,6,,,,voiceover,,voiceover,,,,,,,,,,,,,,,,,,,,,,,,
03:24.5,03:28.1,7,,,,Wife_W01_WW,Wife_W01_WW,如果我出差出去了从晚上十点开始打电话,Rúguǒ wǒ chūchāi Chūqùle cóng wǎnshàng shí diǎn kāishǐ dǎ diànhuà,If I'm on a business trip he'll start calling from 10pm,hostess,,,,,,,,,,antagonist,-ve,judgement,invoke,up-scaling,,从到,,,monoglossic,,
03:28.1,03:30.3,7,,,,,Wife_W01_WW,一直会有时候会打到天亮,yīzhí huì yǒu shíhòu huì dǎ dào tiānliàng,Sometimes he will continue calling me until dawn,hostess,,,,,,,,,,antagonist,-ve,judgement,invoke,up-scaling,,一直,up:isolated,到天亮,monoglossic,,
03:30.3,03:44.9,7,,,,voiceover,,voiceover,,,,,,,,,,,,,,,,,,,,,,,,
03:44.9,03:46.8,8,,,,Wife_W01_WW,Wife_W01_WW,每一次打都是二三十个未接,Měi yīcì dǎ dōu shì èrsānshí gè wèi jiē,Every time there will be 20 or 30 missed calls,hostess,,,,,,,,,,antagonist,-ve,judgement,invoke,up-scaling,,每次,up:isolated,二三十个,monoglossic,,
03:46.8,03:48.3,8,,,,,Wife_W01_WW,有一次是四十多个,yǒu yīcì shì sìshí duō gè,Once it was more than forty,hostess,,,,,,,,,,antagonist,-ve,judgement,invoke,up-scaling,,四十,,,monoglossic,,
03:48.3,03:51.9,8,,,,,Wife_W01_WW,打电话就是说你跟谁出去的..你现在在哪里跟谁出去的,dǎ diànhuà jiùshì shuō nǐ gēn shéi chūqù de.. Nǐ xiànzài zài nǎlǐ gēn shéi chūqù de,He calls just to say whom you went out with.. Where are you now who are you going out with,hostess,,,,,,,,,,antagonist,-ve,judgement,invoke,quotation:other,,说,,,contract:disclaim,就,
03:51.9,03:53.8,8,,,,,Wife_W01_WW,他这样影响我的办事效率,tā zhèyàng yǐngxiǎng wǒ de bànshì xiàolǜ,Such behaviours hinder my efficiency,hostess,,,,,,,,,,antagonist,-ve,judgement,inscribe,,,影响,,,monoglossic,,
03:53.8,03:58.6,8,,,,voiceover,,voiceover,,,,,,,,,,,,,,,,,,,,,,,,
03:58.6,04:00.4,9,,,,Husband_W01_AH,Husband_W01_AH,她把我拉黑了,Tā Bǎ wǒ lā hēile,She blacklisted me,hostess,VoE,,,,,,,,,antagonist,-ve,judgement,inscribe,,,拉黑,,,monoglossic,,
04:00.4,04:01.1,10,,,,Hostess_W01,Hostess_W01,嗯,ń,Mmm,husband,,,,,,,,,,,,,,,,,,,,,
04:01.1,04:03.0,11,,,,Husband_W01_AH,Husband_W01_AH,那我不知道她的信息,nà wǒ bù zhīdào tā de xìnxī,Then I don't know her information,hostess,,,,,,,,,,,,,,,,,,,,,
04:03.0,04:04.9,11,,,,,Husband_W01_AH,你说我该不该联系她,nǐ shuō wǒ Gāi bù gāi liánxì tā,You tell should I contact her or not,hostess,IVoE,,,,,,,,,self,+ve,judgement,invoke,rhetorical question,,该不该,,,expand:entertain,你说,
04:04.9,04:08.5,11,,,,,Husband_W01_AH,安全..我的目的就是..保证她安全到达目的地,ānquán.. Wǒ de mùdì jiùshì.. Bǎozhèng tā ānquán dàodá mùdì de,Safety.. My purpose is to .. ensure that she arrives at her destination safely,hostess,IVoE,,,,,,,,,self,+ve,judgement,inscribe,,,保证安全,,,contract:proclaim,目的是,
04:08.5,04:09.7,12,,,,Wife_W01_WW,Wife_W01_WW,他..前面打我会接,Tā.. Qiánmiàn dǎ wǒ huì jiē ,He.. previously I would answer his call,hostess,,该联系她,IVoE,前面打我接,reorient to an alternative VE,reorient,VoE,Yes,VoE; IVoE,self,+ve,judgement,invoke,contrast,,前面,,,contract:proclaim,会,
04:09.7,04:11.1,12,,,,,Wife_W01_WW,我会告诉他我在哪里,wǒ huì gàosù tā wǒ zài nǎlǐ ,I would tell him where I was,hostess,,,,,,,,,,self,+ve,judgement,invoke,quotation:self,,告诉,,,contract:proclaim,会,
04:11.1,04:12.6,12,,,,,Wife_W01_WW,但是他就是不相信,dànshì tā jiùshì bù xiāngxìn,But he just didn't believe,hostess,,,,,,,,,,antagonist,-ve,judgement,invoke,denial,,不,,,contract:disclaim,但是,
04:13.7,04:27.9,12,,,,voiceover,,voiceover,,,,,,,,,,,,,,,,,,,,,,,,
04:27.9,04:32.2,13,,,,Wife_W01_WW,Wife_W01_WW,如果人家来我们这边喝茶来我们这边坐他看到朋友来了他所有的事情不做,Rúguǒ rénjiā lái wǒmen zhè biān hē chá lái wǒmen zhè biān zuò tā kàn dào péngyǒu láile tā suǒyǒu de shìqíng bù zuò ,If someone visited our company to drink tea came to our office and sat there when he saw a friend come he would not do anything,hostess,,,,,,,,,,,,,,,,,,,,,
04:32.2,04:34.0,13,,,,,Wife_W01_WW,他也就一直跟着屁股后面,tā yě jiù yīzhí gēnzhe pìgu hòumiàn ,He just followed behind the ass of the friend,hostess,,,,,,,,,,antagonist,-ve,judgement,inscribe,,,跟屁股后面,up:isolated,一直,contract:disclaim,就,
04:34.0,04:35.9,13,,,,,Wife_W01_WW,再重要的事情他都可以丢下不管,zài zhòngyào de shìqíng tā dōu kěyǐ diū xià bùguǎn ,No matter how important the business was he could just leave it behind,hostess,,,,,,,,,,antagonist,-ve,judgement,inscribe,,,丢下不管,up:isolated,再重要的事,contract:disclaim,都,
04:35.9,04:37.6,14,,,,Hostess_W01,Hostess_W01,来的这个朋友是什么人,lái de zhège péngyǒu shì shénme rén ,Who was this visiting friend,wife,,,,,,,,,,,,,,,,,,,,,
04:37.6,04:40.0,15,,,,Wife_W01_WW,Wife_W01_WW,当然是跟我们公司有业务来往的,dāngrán shì gēn wǒmen gōngsī yǒu yèwù láiwǎng de ,Of course someone had a business relationship with our company,hostess,,,,,,,,,,self,+ve,judgement,invoke,evoke,,有业务,,,contract:proclaim,当然,
04:40.0,04:41.4,15,,,,,Wife_W01_WW,男的,nán de ,Male,hostess,,,,,,,,,,,,,,,,,,,,,
04:42.3,04:46.2,16,O,,,Hostess_W01,Hostess_W01,他这样子放下[手中]的活不干过来是陪客人呢还是来干嘛呢,tā zhèyàng zi fàngxià [shǒuzhōng] de huó bù gān guòlái shì péi kèrén ne háishì lái gàn ma ne,He put down the work [left the work behind] like this did he do this to host the guests or to do something else,wife,,,,,,,,,,,,,,,,,,,,,
04:42.4,04:42.5,17,O,I,,Wife_W01_WW,Wife_W01_WW,[他],Tā ,He,hostess,,,,,,,,,,,,,,,,,,,,,
04:46.2,04:47.2,17,,,,,Wife_W01_WW,他不跟人家讲话的,tā bù gēn rénjiā jiǎnghuà de,He didn't talk to the guest,hostess,VoE,,,,,,,,,antagonist,-ve,judgement,invoke,denial,,不讲话,,,contract:proclaim,的,
04:47.2,04:48.4,17,,,,,Wife_W01_WW,基本上是不跟人家讲话的, jīběn shàng shì bù gēn rénjiā jiǎnghuà de ,He almost never talked to the guest,hostess,VoE,,,,,,,,,antagonist,-ve,judgement,invoke,denial,,不讲话,down:isolated,基本上,expand:entertain,基本上,
04:48.4,04:49.2,17,,,,,Wife_W01_WW,就是坐在那里,jiùshì zuò zài nàlǐ ,He just sat there,hostess,VoE,,,,,,,,,antagonist,-ve,judgement,invoke,evoke,,坐着,,,contract:proclaim,就,
04:49.2,04:51.4,17,,,,,Wife_W01_WW,就是反正看你们两个聊天,jiùshì fǎnzhèng kàn nǐmen liǎng gè liáotiān ,Anyway he just sat there and watched you two talking,hostess,VoE,,,,,,,,,antagonist,-ve,judgement,invoke,evoke,,看,,,contract:proclaim,反正,
04:51.4,04:52.3,17,,,,,Wife_W01_WW,听你们聊天啊,tīng nǐmen liáotiān a ,He just listened to what you two were talking [+ particle a],hostess,VoE,,,,,,,,,antagonist,-ve,judgement,invoke,evoke,,听,,,contract:proclaim,就,啊
04:52.3,04:54.6,17,,,,,Wife_W01_WW,他这种行为我不能接受,tā zhè zhǒng xíngwéi Wǒ bùnéng jiēshòu ,His behaviours like this I can't accept,hostess,IVoE,,,,,,,,,antagonist,-ve,judgement,invoke,attitudinal token,antagonist,不能接受,,,monoglossic,,
04:54.6,04:57.3,17,,,,,Wife_W01_WW,我就认为他不信任的一种态度呀,wǒ jiù rènwéi tā Bù xìnrèn de yī zhǒng tàidù ya,I just think he has an attitude of distrust [+particle ya],hostess,ExAss,,,,,,,,,antagonist,-ve,judgement,inscribe,,,不信任,,,contract:proclaim,认为,呀
04:57.6,04:59.0,18,,,,Hostess_W01,Hostess_W01,来看着你的,Lái Kànzhe nǐ de,He came to keep you under surveillance,wife,,,,,,,,,,husband,-ve,judgement,invoke,evoke,,,,,,,
04:59.0,04:59.9,19,,,,Wife_W01_WW,Wife_W01_WW,对呀,duì ya ,Exactly,hostess,IVoE,,,,,,,,,antagonist,-ve,judgement,invoke,affirmation,,看着你,,,monoglossic,,
05:00.8,05:01.7,20,,,,Husband_W01_AH,Husband_W01_AH,没有,méiyǒu,No,hostess,,看着你,IVoE,没有,reject or question the interpretation,challenge,IVoE,Yes,VoE; IVoE; ExAss,antagonist,-ve,judgement,invoke,denial,,没有,,,monoglossic,,
05:01.7,05:04.0,20,,,,,Husband_W01_AH,我也没有想过要去监视她,Wǒ yě méiyǒu xiǎngguò yào qù jiānshì tā,"I have never thought about monitoring her, either",hostess,,看着你,IVoE,没有想,reject or question the interpretation,challenge,IVoE,Yes,VoE; IVoE; ExAss,self,+ve,judgement,invoke,denial,,没有,,,contract:disclaim,也,
05:04.0,05:07.3,20,,,,,Husband_W01_AH,我也没有想过我在这里干什么啊,Wǒ yě méiyǒu xiǎngguò wǒ zài zhèlǐ gànshénme a ,I have never thought about why I sat there,hostess,,看着你,IVoE,没有想,reject or question the interpretation,challenge,IVoE,Yes,VoE; IVoE; ExAss,self,+ve,judgement,invoke,denial,,没有,,,contract:disclaim,也,啊
05:07.3,05:09.0,20,,,,,Husband_W01_AH,我只是坐在那里坐一下子,wǒ zhǐshì zuò zài nàlǐ zuò yīxià zi ,I just sat there very briefly,hostess,,坐在那里,VoE,坐一下,replace with an alternative VE,replace,VoE,Yes,VoE; IVoE; ExAss,self,+ve,judgement,invoke,evoke,,坐,down:isolated,一下,contract:disclaim,只是,
05:09.0,05:10.5,20,,,,,Husband_W01_AH,你说可不可以坐一下子,nǐ shuō kěbù kěyǐ zuò yīxià zi ,You tell if I could sit there briefly,hostess,,,,,,,,,,self,+ve,judgement,invoke,rhetorical question,,可不可以,down:isolated,一下,expand:entertain,你说,
05:10.5,05:12.4,20,,,,,Husband_W01_AH,她说手中的重要的活,tā shuō shǒuzhōng de zhòngyào de huó ,She said I had important work at the time,hostess,,,,,,,,,,antagonist,-ve,judgement,invoke,quotation:other,,她说,,,expand:attribute,,
05:12.4,05:15.3,20,,,,,Husband_W01_AH,我还没有想到..什么是重要的活,wǒ hái méiyǒu xiǎngdào.. Shénme shì zhòngyào de huó ,I didn't figure out.. What the important work was,hostess,,重要的活,VoE,没有重要的活,reject the VE,challenge,VoE,Yes,VoE; IVoE; ExAss,antagonist,-ve,judgement,invoke,contrast,,她/我,,,expand:entertain,没想到,
05:15.3,05:17.3,20,O,,,,Husband_W01_AH,放下来坐在那里[跟他],fàng xiàlái zuò zài nàlǐ [gēn tā],I put the work down and sat there [with him],hostess,,,,,,,,,,,,,,,,,,,,,
05:17.0,05:20.6,21,O,I,S,Hostess_W01,Hostess_W01,[吭]胡先生所以你的意思是告诉我们..你确实会那样坐在那儿,[Kēng] hú xiānshēng suǒyǐ nǐ de yìsi shì gàosù wǒmen.. Nǐ quèshí huì nàyàng zuò zài nà'er ,Hmm Mr. Hu so you want to tell us.. You did sit there like that,husband,,,,,,,,,,,,,,,,,,,,,
05:20.6,05:22.6,21,,,,,Hostess_W01,但是坐在那儿你什么都没想,dànshì zuò zài nà'er nǐ shénme dōu méi xiǎng ,But while sitting there there was nothing in your mind,husband,,,,,,,,,,,,,,,,,,,,,
05:22.6,05:23.7,22,,,,Husband_W01_AH,Husband_W01_AH,有跟他聊天,yǒu gēn tā liáotiān ,I talked to him,hostess,,,,,,,,,,self,+ve,judgement,invoke,proclaim,,有,,,monoglossic,,
05:23.7,05:24.9,22,,,,,Husband_W01_AH,有跟客户[那个人]聊天,yǒu gēn kèhù [nàgè rén] liáotiān ,I talked to the client [that man] ,hostess,,,,,,,,,,self,+ve,judgement,invoke,proclaim,,有,,,monoglossic,,
05:24.3,05:24.9,23,O,I,,Hostess_W01,Hostess_W01,[客户],[kèhù] ,The client,hostess,,,,,,,,,,,,,,,,,,,,,
05:24.9,05:26.6,24,O,,,Husband_W01_AH,Husband_W01_AH,客户[那个人],kèhù [nàgè rén],The client [that man],hostess,,,,,,,,,,,,,,,,,,,,,
05:25.6,05:28.3,25,O,I,S,Hostess_W01,Hostess_W01,[那你就]告诉我们你过来是招呼[客人]的吧对吧,[Nà nǐ jiù] gàosù wǒmen nǐ guòlái shì zhāohū [kèrén] de ba duì ba ,[Then you just] tell us that you came here to greet [the guest] right,husband,,,,,,,,,,,,,,,,,,,,,
05:27.6,05:27.8,26,O,I,,Husband_W01_AH,Husband_W01_AH,[啊在],[a zài] ,[Ah yes],hostess,,,,,,,,,,,,,,,,,,,,,
05:28.2,05:29.5,26,O,I,S,,Husband_W01_AH,基本上是这样子,jīběn shàng shì zhèyàng zi ,Basically like this,hostess,VoE,,,,,,,,,self,+ve,judgement,invoke,affirmation,,招呼客人,down:isolated,基本上,expand:entertain,基本上,
05:29.5,05:32.5,26,,,,,Husband_W01_AH,没有什么好那个做文章的啊,méiyǒu shé me hǎo nàgè zuò wénzhāng de a,There is no such thing to make a fuss,hostess,IVoE,,,,,,,,,antagonist,-ve,judgement,inscribe,,,做文章,,,contract:disclaim,没什么,啊
05:32.5,05:36.5,27,,,,Wife_W01_WW,Wife_W01_WW,去年客户来了 吃了饭以后我们就去KTV玩,Qùnián kèhù láile chīle fàn yǐhòu wǒmen jiù qù KTV wán ,Last year the client came and after dinner we went to a KTV,hostess,,没有什么做文章的,IVoE,去年,reorient to an alternative VE,reorient,VoE,Yes,VoE; IVoE; ExAss,,,,,,,,,,,,
05:36.5,05:39.4,27,,,,,Wife_W01_WW,在KTV里面玩呢因为是声音比较大..唱歌,zài KTV lǐmiàn wán ne yīn wéi shì shēngyīn bǐjiào dà.. Chànggē ,In the KTV because it was very noisy.. People singing,hostess,,,,,,,,,,,,,,,,,,,,,
05:39.4,05:46.6,27,,,,,Wife_W01_WW,我就跟我一个比我更小的小几岁的一个弟弟哈我们在谈..一个那个..也是..关于经济的问题,wǒ jiù gēn wǒ yīgè bǐ wǒ gèng xiǎo de xiǎo jǐ suì de yīgè dìdì hā wǒmen zài tán.. Yīgè nàgè.. Yěshì.. Guānyú jīngjì de wèntí ,I just talked to a younger brother a man a few years younger than me we chatted.. about one well.. also.. about an economic issue,hostess,,,,,,,,,,,,,,,,,,,,,
05:46.6,05:49.9,27,,,,,Wife_W01_WW,然后我们..因为声音比较大头就挨得比较近,ránhòu wǒmen.. Yīnwèi shēngyīn bǐjiào dàtóu jiù āi dé bǐjiào jìn ,Then we...because the noise was very loud our heads got somehow close,hostess,,,,,,,,,,,,,,,,,,,,,
05:49.9,05:52.5,27,,,,,Wife_W01_WW,挨的比较近我老公就拍拍照..发给我,āi de bǐjiào jìn wǒ lǎogōng jiù pāi pāizhào.. Fā gěi wǒ ,Our head got somehow close then my husband took took a photo of us.. and sent it to me,hostess,,,,,,,,,,antagonist,-ve,judgement,invoke,evoke,,拍照,,,contract:disclaim,就,
05:52.5,05:54.8,27,,,,,Wife_W01_WW,晚上回来就把照片发给我,wǎnshàng huílái jiù bǎ zhàopiàn fā gěi wǒ ,He sent me the photo when we came back home that night,hostess,,,,,,,,,,,,,,,,,,,,,
05:54.8,05:58.0,27,,,,,Wife_W01_WW,他说你看你跟别人聊天那个多亲热啊,tā shuō nǐ kàn nǐ gēn biérén liáotiān nàgè duō qīnrè a ,He said look how affectionate you were when you were chatting with others,hostess,,,,,,,,,,antagonist,-ve,judgement,invoke,quotation:other,,他说,,,monoglossic,,
05:58.0,06:00.7,27,,,,,Wife_W01_WW,然后跟我嘛..就没话说,ránhòu gēn wǒ ma.. Jiù méi huàshuō ,Then when you chat with me.. You will have nothing to say,hostess,,,,,,,,,,antagonist,-ve,judgement,invoke,contrast,,跟他/跟我,,,monoglossic,,
06:00.7,06:01.8,27,,,,,Wife_W01_WW,我也就没有回答,wǒ yě jiù méiyǒu huídá ,I didn't answer,hostess,,,,,,,,,,self,+ve,judgement,invoke,denial,,没回答,,,contract:disclaim,也,
06:01.8,06:03.1,27,,,,,Wife_W01_WW,也没理他,yě méi lǐ tā ,I ignored him,hostess,,,,,,,,,,self,+ve,judgement,invoke,denial,,没理,,,contract:disclaim,也,
06:03.1,06:07.0,27,,,,,Wife_W01_WW,他就是..就是说..怀疑我跟人家关系比较亲密啊,tā jiùshì.. Jiùshì shuō.. Huáiyí wǒ gēn rénjiā guānxì bǐjiào qīnmì a ,He was just..that is to say.. he suspected that I had a closer relationship with that man,hostess,,,,,,,,,,antagonist,-ve,judgement,inscribe,,,怀疑,,,contract:proclaim,就是说,啊
06:07.0,06:12.9,27,,,,,Wife_W01_WW,其实如果是你信任自己的老婆是吗都在这里玩..就没必要你拍一些这样的照片,qíshí rúguǒ shì nǐ xìnrèn zìjǐ de lǎopó shì ma dōu zài zhèlǐ wán.. Jiù méi bìyào nǐ pāi yīxiē zhèyàng de zhàopiàn,Actually if you trust your wife isn't it everyone was there.. there was no need for you to take some photos like this,hostess,,,,,,,,,,antagonist,-ve,judgement,invoke,denial,,没必要,,,contract:proclaim,其实,
06:12.9,06:13.3,28,,,,Hostess_W01,Hostess_W01,明白,Míngbái ,I understand,wife,,,,,,,,,,,,,,,,,,,,,
06:13.3,06:15.0,29,,,,Wife_W01_WW,Wife_W01_WW,本身就是正常的一个聊天,běnshēn jiùshì zhèngcháng de yīgè liáotiān ,It was essentially a normal chat,hostess,,,,,,,,,,self,+ve,judgement,inscribe,,,正常,,,contract:proclaim,本身,
06:15.0,06:16.5,29,,,,,Wife_W01_WW,因为声音比较大,yīnwèi shēngyīn bǐjiào dà ,Because it was very noisy,hostess,,,,,,,,,,,,,,,,,,,,,
06:16.5,06:17.6,30,,,,Hostess_W01,Hostess_W01,那你有跟他解释吗,nà nǐ yǒu gēn tā jiěshì ma ,Did you explain to him,wife,,,,,,,,,,,,,,,,,,,,,
06:17.6,06:18.4,31,,,,Wife_W01_WW,Wife_W01_WW,没有,méiyǒu ,No,hostess,,,,,,,,,,,,,,,,,,,,,
06:18.4,06:19.6,32,,,,Hostess_W01,Hostess_W01,这件事也就,zhè jiàn shì yě jiù ,This matter was just,wife,,,,,,,,,,,,,,,,,,,,,
06:19.6,06:21.3,33,,,,Wife_W01_WW,Wife_W01_WW,因为我跟他解释不清楚,yīnwèi wǒ gēn tā jiěshì bù qīngchǔ ,Because I couldn't explain it clearly to him,hostess,,,,,,,,,,antagonist,-ve,judgement,invoke,denial,,解释不清,,,contract:proclaim,因为,
06:21.3,06:22.7,34,,,,Hostess_W01,Hostess_W01,也就不了了之过去了,yě jiù bù liǎo liǎo zhī guòqùle ,You just let it go,wife,,,,,,,,,,,,,,,,,,,,,
06:22.7,06:23.5,35,,,,Wife_W01_WW,Wife_W01_WW,对,duì,Correct,hostess,,,,,,,,,,,,,,,,,,,,,
